name,price,socket,form_factor,max_memory,memory_slots,color
MSI MAG B550 TOMAHAWK,169.99,AM4,ATX,128,4,Black / Silver
MSI B550-A PRO,139.99,AM4,ATX,128,4,Black / Silver
MSI B550M PRO-VDH WIFI,119.99,AM4,Micro ATX,128,4,Black
Gigabyte Z790 AORUS ELITE AX,239.99,LGA1700,ATX,128,4,Black
Asus Prime B450M-A II,79.99,AM4,Micro ATX,128,4,
MSI MAG B660 TOMAHAWK WIFI DDR4,189.99,LGA1700,ATX,128,4,Black / Silver
Gigabyte B650 AORUS ELITE AX,202.3,AM5,ATX,128,4,Black / Silver
Asus ROG STRIX B550-A GAMING,169.99,AM4,ATX,128,4,Black / White
MSI MAG Z790 TOMAHAWK WIFI,276.79,LGA1700,ATX,192,4,Black
MSI MAG B650 TOMAHAWK WIFI,219.95,AM5,ATX,128,4,Black
Asus TUF GAMING X570-PLUS (WI-FI),199.99,AM4,ATX,128,4,Black / Gold
Gigabyte B660M DS3H AX DDR4,99.99,LGA1700,Micro ATX,128,4,Black
Gigabyte B650 GAMING X AX,169.99,AM5,ATX,128,4,Black / Gray
Gigabyte B550M DS3H,107.99,AM4,Micro ATX,128,4,Black / Gold
Asus ROG STRIX B550-F GAMING WIFI II,189.99,AM4,ATX,128,4,Black / Red
MSI B550 GAMING GEN3,117.36,AM4,ATX,128,4,Black
MSI PRO Z790-P WIFI,217.42,LGA1700,ATX,128,4,Black / Silver
Gigabyte B450M DS3H WIFI,79.99,AM4,Micro ATX,64,4,Brown / Black
MSI MAG B660M MORTAR WIFI DDR4,168.96,LGA1700,Micro ATX,128,4,Silver / Black
Gigabyte B550 AORUS ELITE AX V2,159.99,AM4,ATX,128,4,Black / Silver
Asus ROG STRIX B650E-F GAMING WIFI,267.73,AM5,ATX,128,4,Black
ASRock B550M Pro4,106.99,AM4,Micro ATX,128,4,Silver / Black
Asus ROG STRIX Z690-A GAMING WIFI D4,442.71,LGA1700,ATX,128,4,Silver / Black
Asus TUF GAMING B550-PLUS WIFI II,169.99,AM4,ATX,128,4,Black / Gray
MSI B450M PRO-VDH MAX,79.98,AM4,Micro ATX,64,4,Black / Silver
MSI MPG B550 GAMING PLUS,149.99,AM4,ATX,128,4,Black
Gigabyte B650I AORUS ULTRA,259.99,AM5,Mini ITX,64,2,Black / Silver
MSI PRO B760-P WIFI DDR4,161.98,LGA1700,ATX,128,4,Black
Asus ROG STRIX B760-I GAMING WIFI,218.99,LGA1700,Mini ITX,64,2,Black
MSI PRO B650-P WIFI,189.99,AM5,ATX,128,4,Black
MSI PRO B650M-A WIFI,165.95,AM5,Micro ATX,128,4,Black
MSI PRO B550M-VC WIFI,118.61,AM4,Micro ATX,128,4,Black
MSI A520M-A PRO,75.99,AM4,Micro ATX,64,2,Black
MSI MAG Z690 TOMAHAWK WIFI DDR4,239.99,LGA1700,ATX,128,4,Black / Silver
Asus ROG STRIX Z790-E GAMING WIFI,485.14,LGA1700,ATX,128,4,Black
Gigabyte A520I AC,109.99,AM4,Mini ITX,64,2,Black
Asus PRIME Z690-P WIFI D4,199.0,LGA1700,ATX,128,4,Silver / Black
MSI MAG X670E TOMAHAWK WIFI,309.99,AM5,ATX,192,4,Black
Asus ROG MAXIMUS Z790 HERO,588.85,LGA1700,ATX,128,4,Black
Gigabyte B650M DS3H,139.99,AM5,Micro ATX,128,4,Brown / Black
MSI PRO H610M-G DDR4,79.99,LGA1700,Micro ATX,64,2,Black / Silver
MSI MAG B550 TOMAHAWK MAX WIFI,199.99,AM4,ATX,128,4,Silver / Black
ASRock B660M Pro RS,89.99,LGA1700,Micro ATX,128,4,Gray / Black
ASRock A520M-HDV,70.42,AM4,Micro ATX,64,2,Black / Silver
Asus TUF GAMING B650-PLUS WIFI,227.99,AM5,ATX,128,4,Black
Asus ROG STRIX X670E-E GAMING WIFI,484.99,AM5,ATX,128,4,Black / Silver
Gigabyte B550I AORUS PRO AX,169.99,AM4,Mini ITX,64,2,Black / Silver
Asus TUF GAMING Z790-PLUS WIFI,269.99,LGA1700,ATX,128,4,Black / Gray
ASRock B550M-ITX/ac,129.99,AM4,Mini ITX,64,2,Silver / Black
MSI PRO Z690-A WIFI DDR4,169.95,LGA1700,ATX,128,4,Black / Silver
Asus TUF GAMING A520M-PLUS WIFI,99.99,AM4,Micro ATX,128,4,Black / Orange
Gigabyte B550 GAMING X V2,109.99,AM4,ATX,128,4,Black
MSI MPG B650I EDGE WIFI,274.27,AM5,Mini ITX,64,2,Black / Silver
Gigabyte B550M DS3H AC,87.99,AM4,Micro ATX,128,4,Black
Gigabyte B760 GAMING X AX,159.99,LGA1700,ATX,128,4,Black / Gray
Asus ROG STRIX B550-F GAMING,175.6,AM4,ATX,128,4,Black
MSI PRO B660M-A WIFI DDR4,173.5,LGA1700,Micro ATX,128,4,Black / Silver
Asus ROG ZENITH II EXTREME ALPHA,2059.0,sTRX4,EATX,256,8,Black / Silver
ASRock B550M Phantom Gaming 4,86.99,AM4,Micro ATX,128,4,Black
Gigabyte B650M AORUS ELITE AX,189.99,AM5,Micro ATX,128,4,Black
Asus ROG STRIX B650-A GAMING WIFI,244.99,AM5,ATX,128,4,Black / Silver
Asus PRIME B550M-A WIFI II,129.99,AM4,Micro ATX,128,4,Blue / Silver
ASRock B650M Pro RS WiFi,124.99,AM5,Micro ATX,128,4,Black / Silver
Gigabyte B550M AORUS ELITE,130.19,AM4,Micro ATX,128,4,Black / Orange
Asus PRIME Z790-A WIFI,279.99,LGA1700,ATX,128,4,Black / Silver
MSI MPG Z490 GAMING EDGE WIFI,,LGA1200,ATX,128,4,Black / Silver
MSI MPG Z490 GAMING PLUS,109.99,LGA1200,ATX,128,4,Black / Silver
ASRock B550 Phantom Gaming 4/ac,89.99,AM4,ATX,128,4,Silver / Black
ASRock Z690M-ITX/ax,171.17,LGA1700,Mini ITX,64,2,Silver / Black
Gigabyte X670 AORUS ELITE AX (rev. 1.0),269.99,AM5,ATX,128,4,Black
ASRock B650M-HDV/M.2,124.99,AM5,Micro ATX,64,2,Silver / Black
Gigabyte X570S AORUS ELITE AX,189.99,AM4,ATX,128,4,Black / Silver
Asus TUF GAMING B550M-PLUS WIFI II,159.99,AM4,Micro ATX,128,4,Black / Gray
Gigabyte B760M DS3H AX DDR4,178.5,LGA1700,Micro ATX,128,4,Black
MSI MPG Z790 EDGE WIFI,339.99,LGA1700,ATX,128,4,Silver / Black
ASRock B660M-HDV,97.73,LGA1700,Micro ATX,64,2,Gray / Black
Asus ROG STRIX Z690-E GAMING WIFI,265.99,LGA1700,ATX,128,4,Black
MSI PRO B760M-P DDR4,99.95,LGA1700,Micro ATX,128,4,Black
NZXT N7 Z790,299.99,LGA1700,ATX,128,4,White / Black
ASRock H570 Phantom Gaming 4,81.0,LGA1200,ATX,128,4,Silver / Black
Asus PRIME B550-PLUS,129.99,AM4,ATX,128,4,Black / White
Gigabyte B760M AORUS ELITE AX,119.99,LGA1700,Micro ATX,128,4,Black / Silver
Gigabyte B760 AORUS ELITE AX,159.99,LGA1700,ATX,128,4,Black
Asus ROG STRIX B650E-I GAMING WIFI,324.99,AM5,Mini ITX,64,2,Black
MSI PRO X670-P WIFI,229.95,AM5,ATX,128,4,Black / White
Asus PRIME B660-PLUS D4,179.94,LGA1700,ATX,128,4,Silver / Black
Gigabyte A520M S2H,74.98,AM4,Micro ATX,64,2,Black
Asus PRIME Z790-P WIFI,222.98,LGA1700,ATX,128,4,Black / Silver
MSI MPG B650 EDGE WIFI,239.99,AM5,ATX,128,4,Black / Silver
Gigabyte B550M K,79.98,AM4,Micro ATX,128,4,Brown / Silver
ASRock B550M-HDV,79.98,AM4,Micro ATX,64,2,Black
MSI B450 TOMAHAWK MAX,,AM4,ATX,128,4,Black
MSI MPG X670E CARBON WIFI,439.99,AM5,ATX,128,4,Black
ASRock Z790 PG LIGHTNING,179.99,LGA1700,ATX,128,4,Black
Gigabyte B550 AORUS ELITE V2,163.43,AM4,ATX,128,4,Black
Asus ROG STRIX B760-A GAMING WIFI D4,218.99,LGA1700,ATX,128,4,Silver / Black
Asus PRIME A320M-K,96.78,AM4,Micro ATX,32,2,Black / White
Asus TUF GAMING X670E-PLUS WIFI,301.2,AM5,ATX,128,4,Black / Orange
Asus PRIME B660M-A WIFI D4,164.37,LGA1700,Micro ATX,128,4,Silver / Black
Asus ROG STRIX B450-F GAMING,279.0,AM4,ATX,64,4,Black
ASRock B550 Phantom Gaming 4,84.99,AM4,ATX,128,4,Silver / Black
MSI PRO Z790-A WIFI,219.99,LGA1700,ATX,128,4,Black / Silver
NZXT N7 B550,249.99,AM4,ATX,128,4,White / Black
ASRock B550 Phantom Gaming-ITX/ax,191.25,AM4,Mini ITX,64,2,Silver / Black
MSI MAG B650M MORTAR WIFI,199.95,AM5,Micro ATX,128,4,Black
NZXT N7 B650E,316.99,AM5,ATX,128,4,White
ASRock B550M Steel Legend,129.99,AM4,Micro ATX,128,4,Silver / Black
Gigabyte B650M K,119.99,AM5,Micro ATX,128,4,Brown / Silver
Asus ROG STRIX X670E-I GAMING WIFI,429.99,AM5,Mini ITX,64,2,Black / Silver
MSI B450I GAMING PLUS MAX WIFI,149.99,AM4,Mini ITX,64,2,Black
ASRock B550 Pro4,114.99,AM4,ATX,128,4,Silver / Black
ASRock B550M PG RIPTIDE,89.99,AM4,Micro ATX,128,4,
Asus ROG STRIX Z790-A GAMING WIFI,349.99,LGA1700,ATX,128,4,Silver / Black
Asus ROG CROSSHAIR X670E HERO,656.53,AM5,ATX,128,4,Black / Silver
MSI MAG B760 TOMAHAWK WIFI,199.99,LGA1700,ATX,128,4,Black
ASRock B450M Pro4,139.99,AM4,Micro ATX,128,4,Black / Silver
ASRock X670E Steel Legend,299.99,AM5,ATX,128,4,Black / White
MSI MAG X570S TOMAHAWK MAX WIFI,279.5,AM4,ATX,128,4,Black
MSI MPG X570S EDGE MAX WIFI,199.99,AM4,ATX,128,4,Black / Silver
Asus ROG STRIX X670E-A GAMING WIFI,385.99,AM5,ATX,128,4,Silver / Black
Asus TUF GAMING Z690-PLUS WIFI D4,274.99,LGA1700,ATX,128,4,Black / Silver
MSI MAG Z690 TOMAHAWK WIFI,217.0,LGA1700,ATX,128,4,Black / Silver
MSI B760 GAMING PLUS WIFI,159.99,LGA1700,ATX,192,4,Black / Silver
Asus PRIME B650-PLUS,190.99,AM5,ATX,128,4,Black / Silver
ASRock A520M-ITX/ac,136.6,AM4,Mini ITX,64,2,Black / Silver
MSI MEG Z790 GODLIKE,1199.99,LGA1700,EATX,128,4,Black
ASRock A620M Pro RS WiFi,124.99,AM5,Micro ATX,128,4,Silver / Black
MSI PRO Z690-P DDR4,158.69,LGA1700,ATX,128,4,Black / Silver
Gigabyte Z690 AORUS ELITE AX,169.99,LGA1700,ATX,128,4,Black
Asus PRIME A520M-A II/CSM,79.99,AM4,Micro ATX,128,4,Silver / Black
MSI MPG Z790 CARBON WIFI,399.99,LGA1700,ATX,128,4,Black
Asus ROG Crosshair VIII Dark Hero,395.0,AM4,ATX,128,4,Black / Silver
MSI MPG Z690 EDGE WIFI DDR4,269.99,LGA1700,ATX,128,4,Black / Gray
ASRock B450M Steel Legend,109.0,AM4,Micro ATX,64,4,Black / White
Asus PRIME Z390-A,323.0,LGA1151,ATX,128,4,Silver / Black
MSI PRO H610M-B DDR4,109.98,LGA1700,Micro ATX,64,2,Black / Silver
Gigabyte B450 AORUS ELITE V2,128.48,AM4,ATX,128,4,Black
ASRock B760M Steel Legend WiFi,169.99,LGA1700,Micro ATX,128,4,Silver / Black
Asus PRIME X670E-PRO WIFI,334.99,AM5,ATX,128,4,Silver / Black
MSI MAG B760 TOMAHAWK WIFI DDR4,189.99,LGA1700,ATX,128,4,Black
Asus ROG CROSSHAIR X670E EXTREME,999.99,AM5,EATX,128,4,Black / Silver
Asus ROG STRIX X670E-F GAMING WIFI,419.99,AM5,ATX,128,4,Black / Silver
Asus PRIME B760-PLUS D4,143.99,LGA1700,ATX,128,4,Silver / Black
ASRock B660 Steel Legend,119.99,LGA1700,ATX,128,4,Silver / Black
MSI MPG Z790I EDGE WIFI,350.99,LGA1700,Mini ITX,64,2,Silver / Black
ASRock H470M-HDV/M.2,86.82,LGA1200,Micro ATX,64,2,Black / Silver
NZXT N7 Z790,299.99,LGA1700,ATX,128,4,Black
MSI MEG X570 UNIFY,245.99,AM4,ATX,128,4,Black
Gigabyte Z790 UD AX,179.99,LGA1700,ATX,128,4,Black
Gigabyte B660M AORUS Pro AX DDR4,109.99,LGA1700,Micro ATX,128,4,Black
ASRock B650M Pro RS,139.99,AM5,Micro ATX,128,4,Black / Silver
MSI MPG B560I GAMING EDGE WIFI,169.99,LGA1200,Mini ITX,64,2,Black
MSI PRO Z690-A WIFI,198.0,LGA1700,ATX,128,4,Black / Silver
Asus ProArt X670E-CREATOR WIFI,404.99,AM5,ATX,128,4,Black / Copper
MSI MAG Z790 TOMAHAWK WIFI DDR4,244.99,LGA1700,ATX,128,4,Black
MSI PRO A620M-E,84.95,AM5,Micro ATX,64,2,Black
Asus ProArt Z790-CREATOR WIFI,419.99,LGA1700,ATX,128,4,Black / Copper
Asus PRIME H510M-K,119.5,LGA1200,Micro ATX,64,2,Black / Silver
ASRock Z790M-ITX WIFI,189.99,LGA1700,Mini ITX,64,2,Black
MSI B450M-A PRO MAX,75.99,AM4,Micro ATX,32,2,Black
ASRock B650 PRO RS,203.57,AM5,ATX,128,4,Black / Silver
ASRock A520M-HVS,85.2,AM4,Micro ATX,64,2,Black / Silver
ASRock B450M/AC,94.01,AM4,Micro ATX,64,4,Black
ASRock B760M PG Riptide,139.99,LGA1700,Micro ATX,128,4,Black / Blue
Asus PRIME B450M-K II,99.49,AM4,Micro ATX,64,2,Black
Asus ROG STRIX Z790-H GAMING WIFI,299.99,LGA1700,ATX,128,4,Black
Gigabyte B660M AORUS ELITE AX DDR4,109.99,LGA1700,Micro ATX,128,4,Black
Asus ROG STRIX B660-I GAMING WIFI,259.14,LGA1700,Mini ITX,64,2,Black / Silver
Asus ROG Strix X570-I Gaming,371.87,AM4,Mini ITX,64,2,Black
Gigabyte B550 UD AC,109.99,AM4,ATX,128,4,Brown / Black
Asus ROG STRIX B660-A GAMING WIFI D4,282.84,LGA1700,ATX,128,4,Silver / Black
Asus PRIME H610I-PLUS D4-CSM,109.99,LGA1700,Mini ITX,64,2,Silver / Black
Asus TUF GAMING B760M-PLUS WIFI D4,179.99,LGA1700,Micro ATX,128,4,Black / Orange
MSI A320M-A PRO,78.81,AM4,Micro ATX,64,2,Black
ASRock Fatal1ty B450 Gaming-ITX/ac,145.63,AM4,Mini ITX,64,2,Black / Silver
MSI MPG B760I EDGE WIFI,219.95,LGA1700,Mini ITX,64,2,Black / Silver
Asus PRIME Z690-P WIFI,219.99,LGA1700,ATX,128,4,Silver / Black
ASRock B365M Pro4,,LGA1151,Micro ATX,64,4,Black / Silver
MSI B450 Gaming Plus MAX,155.0,AM4,ATX,128,4,Red / Black
ASRock B650M PG RIPTIDE,169.99,AM5,Micro ATX,128,4,Black
ASRock Z790 PRO RS WIFI,194.99,LGA1700,ATX,128,4,Silver / Black
ASRock B650E PG RIPTIDE WIFI,239.99,AM5,ATX,128,4,Black / Blue
Gigabyte Z790 GAMING X AX,229.99,LGA1700,ATX,128,4,Black
Asus PRIME Z790-P WIFI D4,229.99,LGA1700,ATX,128,4,Black / Silver
Gigabyte B760M GAMING X AX DDR4,149.99,LGA1700,Micro ATX,128,4,Black
Gigabyte B450M DS3H,174.99,AM4,Micro ATX,128,4,Black / Silver
Gigabyte Z690 AORUS ELITE AX DDR4,191.13,LGA1700,ATX,128,4,Black / Silver
Asus ROG STRIX Z790-I GAMING WIFI,433.84,LGA1700,Mini ITX,96,2,Black
Asus ROG Strix TRX40-E Gaming,,sTRX4,ATX,256,8,Black
ASRock X670E PG Lightning,259.99,AM5,ATX,128,4,Black
MSI PRO Z790-P WIFI DDR4,219.99,LGA1700,ATX,128,4,Black / Silver
Asus TUF Gaming Z590-PLUS WIFI,,LGA1200,ATX,128,4,Silver / Black
ASRock X570 Steel Legend,145.99,AM4,ATX,128,4,Black / Silver
Gigabyte X670E AORUS MASTER (rev. 1.0),489.99,AM5,EATX,128,4,Black / Silver
MSI MEG X670E GODLIKE,1283.93,AM5,EATX,128,4,Black
Asus TUF GAMING Z790-PLUS WIFI D4,249.99,LGA1700,ATX,128,4,Black
Gigabyte Z790 AORUS MASTER,459.99,LGA1700,EATX,128,4,Black / Silver
Gigabyte Z790 AERO G,279.99,LGA1700,ATX,128,4,
ASRock B650E PG-ITX WIFI,289.99,AM5,Mini ITX,64,2,Black / Red
NZXT N7 B650E,316.99,AM5,ATX,128,4,Black
ASRock B650 PG LIGHTNING,192.99,AM5,ATX,128,4,Black
ASRock X570 Phantom Gaming-ITX/TB3,259.0,AM4,Mini ITX,64,2,Black / Silver
Gigabyte Z690 UD DDR4,226.85,LGA1700,ATX,128,4,Black
ASRock B450 Steel Legend,124.57,AM4,ATX,64,4,Black / Silver
MSI PRO B660M-G DDR4,99.99,LGA1700,Micro ATX,64,2,Black / Silver
MSI Z390-A PRO,239.0,LGA1151,ATX,128,4,Brown / Black
MSI MPG B650 CARBON WIFI,311.47,AM5,ATX,128,4,Black
Asus PRIME Z690-A,219.99,LGA1700,ATX,128,4,Silver / Black
Gigabyte TRX40 AORUS XTREME,1909.0,sTRX4,XL ATX,256,8,Black / Silver
Asus TUF GAMING B550-PLUS,174.5,AM4,ATX,128,4,Black
Gigabyte B760M DS3H AX,129.99,LGA1700,Micro ATX,128,4,Black
Asus ROG STRIX B650E-E GAMING WIFI,349.99,AM5,ATX,128,4,Black
ASRock X570 Phantom Gaming 4,154.99,AM4,ATX,128,4,Black / Silver
Gigabyte A620M GAMING X,99.99,AM5,Micro ATX,128,4,Brown / Gray
MSI PRO B550-VC,139.99,AM4,ATX,128,4,Black
Gigabyte Z790 UD AC,179.99,LGA1700,ATX,128,4,Black
Asus ROG STRIX Z790-A GAMING WIFI D4,339.99,LGA1700,ATX,128,4,Black / Silver
Asus ROG STRIX Z790-F GAMING WIFI,391.99,LGA1700,ATX,128,4,Black
ASRock B450M PRO4 R2.0,74.98,AM4,Micro ATX,128,4,Gray / Black
Asus TUF GAMING B560M-PLUS WIFI,174.47,LGA1200,Micro ATX,128,4,Gold / Black
Gigabyte B650M GAMING X AX,,AM5,Micro ATX,128,4,Black
Asus ROG STRIX Z390-E GAMING,340.0,LGA1151,ATX,128,4,Black
Asus PRIME B550M-A,114.18,AM4,Micro ATX,128,4,Black / White
MSI PRO B760M-A WIFI DDR4,169.99,LGA1700,Micro ATX,128,4,Black
Gigabyte Z690 UD AX DDR4,159.99,LGA1700,ATX,128,4,Black
MSI G41M4-F,,LGA775,Micro ATX,8,2,Red
Asus PRIME B550M-K,132.5,AM4,Micro ATX,128,4,Black / White
Gigabyte H610M S2H,99.99,LGA1700,Micro ATX,64,2,Brown / Silver
Asus ROG STRIX Z690-F GAMING WIFI,249.99,LGA1700,ATX,128,4,Black / Silver
Asus TUF GAMING B650M-PLUS WIFI,219.99,AM5,Micro ATX,128,4,Black
ASRock B450M-HDV R4.0,90.84,AM4,Micro ATX,32,2,Black / White
Asus ROG STRIX Z590-E GAMING WIFI,199.95,LGA1200,ATX,128,4,Black
MSI B450 TOMAHAWK,,AM4,ATX,64,4,Black / Silver
ASRock X570 Steel Legend WiFi ax,139.99,AM4,ATX,128,4,Black / Silver
Gigabyte B760M DS3H DDR4,119.99,LGA1700,Micro ATX,128,4,Black
MSI MPG Z690 CARBON WIFI,280.99,LGA1700,ATX,128,4,Black / Silver
Asus PRIME X670-P,242.02,AM5,ATX,128,4,Silver / Black
Asus TUF GAMING Z690-PLUS WIFI,166.99,LGA1700,ATX,128,4,Black / Gray
MSI MAG B760M MORTAR WIFI,179.95,LGA1700,Micro ATX,128,4,Black / Silver
MSI MEG X670E ACE,699.99,AM5,EATX,128,4,Black / Gold
ASRock B760 Pro RS,129.99,LGA1700,ATX,128,4,Silver / Black
ASRock H310CM-DVS,63.99,LGA1151,Micro ATX,32,2,Black
ASRock B650M PG RIPTIDE WIFI,189.99,AM5,Micro ATX,128,4,Black
MSI PRO Z690-A DDR4,189.99,LGA1700,ATX,128,4,Black / Silver
Gigabyte B660M DS3H DDR4,165.94,LGA1700,Micro ATX,128,4,Black
ASRock X670E Taichi,499.99,AM5,EATX,128,4,Black
NZXT N5 Z690,239.99,LGA1700,ATX,128,4,Black / White
MSI MPG B760I EDGE WIFI DDR4,,LGA1700,Mini ITX,64,2,Silver / Black
MSI PRO B550M-P GEN3,144.84,AM4,Micro ATX,128,4,Black
Asus PRIME B450-PLUS,125.79,AM4,ATX,64,4,Black / Silver
Gigabyte B650 AORUS PRO AX,229.99,AM5,ATX,128,4,Black
Gigabyte H510M H,98.78,LGA1200,Micro ATX,64,2,Black
Asus ROG STRIX B550-I GAMING,,AM4,Mini ITX,64,2,Black
ASRock Z690 STEEL LEGEND/D5,199.99,LGA1700,ATX,128,4,Black / White
ASRock Z590 Extreme WiFi 6E,119.99,LGA1200,ATX,128,4,Black / Blue
Asus TUF GAMING B550M-PLUS,159.99,AM4,Micro ATX,128,4,Black
Asus ROG STRIX X570-E GAMING WIFI II,,AM4,ATX,128,4,Black
Asus PRIME Z390-P,,LGA1151,ATX,128,4,Silver / Black
Gigabyte H610M S2H DDR4,89.99,LGA1700,Micro ATX,64,2,Black / Gray
Asus ROG STRIX B550-F GAMING (WI-FI),398.0,AM4,ATX,128,4,Black
NZXT N7-Z69XT-W1,323.95,LGA1700,ATX,128,4,White / Black
Asus PRIME B660M-A D4,135.99,LGA1700,Micro ATX,128,4,Silver / Black
Gigabyte Z590I AORUS ULTRA,120.99,LGA1200,Mini ITX,64,2,Black
MSI Z490-A PRO,217.16,LGA1200,ATX,128,4,Black / Silver
Asus PRIME X570-PRO,,AM4,ATX,128,4,Black / White
Asus ROG MAXIMUS Z790 APEX,1199.49,LGA1700,ATX,64,2,Silver / Black
MSI MEG Z790 ACE,579.99,LGA1700,EATX,128,4,Gold / Black
Asus ROG STRIX Z690-G GAMING WIFI,284.0,LGA1700,Micro ATX,128,4,Black / Silver
ASRock A620M Pro RS,114.99,AM5,Micro ATX,128,4,Silver / Black
Gigabyte Z390 AORUS PRO WIFI,,LGA1151,ATX,128,4,Black / Silver
Gigabyte B450M K,102.75,AM4,Micro ATX,64,2,Brown / Silver
Asus TUF GAMING B660-PLUS WIFI D4,230.64,LGA1700,ATX,128,4,Yellow / Black
Gigabyte X570S AORUS MASTER,249.99,AM4,ATX,128,4,Black / Silver
ASRock X670E Pro RS,268.99,AM5,ATX,128,4,Black
ASRock H370M-ITX/ac,99.99,LGA1151,Mini ITX,32,2,Black / Silver
Asus PRIME X670-P WIFI,272.99,AM5,ATX,128,4,Silver / Black
Gigabyte B760I AORUS PRO DDR4,179.99,LGA1700,Mini ITX,64,2,Black / Gray
Asus PRIME H610M-K D4,106.32,LGA1700,Micro ATX,64,2,Silver / Black
Asus ROG STRIX B760-F GAMING WIFI,269.99,LGA1700,ATX,128,4,Black
NZXT N7 B550,249.99,AM4,ATX,128,4,Black
ASRock Z790 Steel Legend WiFi,229.99,LGA1700,ATX,128,4,Silver / Black
Asus TUF GAMING B550-PRO,170.38,AM4,ATX,128,4,Black
ASRock H610M-HVS,79.98,LGA1700,Micro ATX,64,2,Gray / Black
Gigabyte GA-A320M-S2H,,AM4,Micro ATX,32,2,Black
Asus TUF GAMING B760-PLUS WIFI D4,199.99,LGA1700,ATX,128,4,Black / Orange
Gigabyte A520 AORUS ELITE,111.05,AM4,ATX,128,4,Black / Orange
Gigabyte A520M DS3H,94.94,AM4,Micro ATX,128,4,Black
Asus PRIME X570-P,258.98,AM4,ATX,128,4,Black / White
Gigabyte B450 AORUS PRO WIFI (rev. 1.0),233.46,AM4,ATX,64,4,Black / Silver
MSI MPG X570S CARBON MAX WIFI,259.99,AM4,ATX,128,4,Black / Silver
Asus PRIME Z790M-PLUS,196.99,LGA1700,Micro ATX,128,4,Silver / Black
ASRock X670E Taichi Carrara,522.99,AM5,EATX,128,4,Black / White
Gigabyte B760 GAMING X DDR4,,LGA1700,ATX,128,4,Black
Gigabyte B660I AORUS Pro DDR4,281.17,LGA1700,Mini ITX,64,2,Black
MSI PRO B660M-P DDR4,125.99,LGA1700,Micro ATX,128,4,Black / Silver
MSI PRO B660-A DDR4,164.08,LGA1700,ATX,128,4,Black / Silver
Asus ROG Crosshair VIII Hero (WI-FI),381.99,AM4,ATX,128,4,Black
Gigabyte Z790 AORUS XTREME,,LGA1700,EATX,128,4,Black
MSI MPG X570 GAMING PLUS,,AM4,ATX,128,4,Black / Red
Asus Z170-A,,LGA1151,ATX,64,4,Black / White
MSI MPG Z790 EDGE WIFI DDR4,259.99,LGA1700,ATX,128,4,Silver / Black
ASRock Z790 Pro RS,189.99,LGA1700,ATX,128,4,Silver / Black
MSI MPG X570 GAMING EDGE WIFI,376.58,AM4,ATX,128,4,Black / Silver
ASRock H670 PG Riptide,,LGA1700,ATX,128,4,Black
ASRock B760M Pro RS/D4,129.99,LGA1700,Micro ATX,128,4,Silver / Black
Asus TUF GAMING B660M-PLUS WIFI D4,201.16,LGA1700,Micro ATX,128,4,Black / Orange
MSI MAG B550M MORTAR MAX WIFI,,AM4,Micro ATX,128,4,Silver / Black
Gigabyte B450M DS3H V2,157.0,AM4,Micro ATX,128,4,Black
Gigabyte H410M H V2,,LGA1200,Micro ATX,64,2,Gray / Black
ASRock B365M-HDV,67.5,LGA1151,Micro ATX,32,2,Black / Silver
Asus ROG MAXIMUS Z790 EXTREME,,LGA1700,EATX,128,4,Black
ASRock B450 Pro4 R2.0,119.99,AM4,ATX,128,4,Black
Asus TUF GAMING B650-PLUS,,AM5,ATX,128,4,Black / Orange
MSI MPG Z690 FORCE WIFI,309.99,LGA1700,ATX,128,4,Silver / Black
Gigabyte B650 AERO G,239.99,AM5,ATX,128,4,Black / Silver
Asus ROG Strix X570-E Gaming,,AM4,ATX,128,4,Black
Asus Prime Z590-P WiFi,140.97,LGA1200,ATX,128,4,Black / Silver
Asus ROG STRIX B450-F GAMING II,,AM4,ATX,128,4,Black
Asus TUF GAMING A620M-PLUS WIFI,149.99,AM5,Micro ATX,128,4,Black / Orange
ASRock B760M-ITX/D4 WiFi,184.18,LGA1700,Mini ITX,64,2,Silver / Black
Asus TUF GAMING B450-PLUS II,,AM4,ATX,128,4,Black
Gigabyte A620M S2H,86.99,AM5,Micro ATX,96,2,Gray / Black
ASRock H610M-ITX/ac,151.04,LGA1700,Mini ITX,64,2,Silver / Black
Asus ROG STRIX Z690-I GAMING WIFI,339.0,LGA1700,Mini ITX,64,2,Black / Silver
Gigabyte Z690 GAMING X DDR4,227.38,LGA1700,ATX,128,4,Black / Gray
Gigabyte X570 I AORUS PRO WIFI,369.0,AM4,Mini ITX,64,2,Black / Silver
Asus PRIME Z790M-PLUS D4,189.0,LGA1700,Micro ATX,128,4,Black / Silver
Gigabyte A520M H,87.69,AM4,Micro ATX,64,2,Black
ASRock B650E STEEL LEGEND WIFI,229.99,AM5,ATX,128,4,Black / Silver
Asus ROG MAXIMUS Z690 HERO,397.99,LGA1700,ATX,128,4,Black / Silver
Asus PRIME B450M-A,199.0,AM4,Micro ATX,64,4,Black
Intel DQ45EK,92.99,LGA775,Mini ITX,4,2,Green / Blue
Gigabyte B560M DS3H V2,,LGA1200,Micro ATX,128,4,Black
Asus TUF GAMING B550M-E WIFI,,AM4,Micro ATX,128,4,Orange / Black
Gigabyte X670E AORUS XTREME (rev. 1.0),699.99,AM5,EATX,128,4,Black
Asus ROG MAXIMUS Z690 FORMULA,920.68,LGA1700,ATX,128,4,Silver / Black
Asus TUF GAMING B760M-PLUS WIFI,194.99,LGA1700,Micro ATX,128,4,Black / Orange
ASRock B760M Pro RS/D4 WiFi,149.99,LGA1700,Micro ATX,128,4,Silver / Black
Gigabyte Z790 AORUS ELITE AX DDR4,234.99,LGA1700,ATX,128,4,Black
Asus ROG MAXIMUS Z690 APEX,1201.0,LGA1700,ATX,64,2,Black / Silver
MSI MAG B660M MORTAR MAX WIFI DDR4,159.99,LGA1700,Micro ATX,128,4,Black / Silver
Asus PRIME A520M-K,107.36,AM4,Micro ATX,64,2,Black / Silver
MSI PRO B650M-P,,AM5,Micro ATX,192,4,Black / Silver
Gigabyte B760M C,134.99,LGA1700,Micro ATX,192,4,Brown / Gray
ASRock B550 Steel Legend,149.99,AM4,ATX,128,4,Silver / Black
Gigabyte B760I AORUS PRO,266.39,LGA1700,Mini ITX,96,2,Silver / Black
Gigabyte B760 DS3H AC DDR4,119.99,LGA1700,ATX,128,4,Black
ASRock Z790 PG-ITX/TB4,334.99,LGA1700,Mini ITX,64,2,Black
MSI Z97-GAMING 5,,LGA1150,ATX,32,4,Black / Red
Asus STRIX B350-F GAMING,199.67,AM4,ATX,64,4,Black
ASRock Z790 PG Lightning/D4,169.99,LGA1700,ATX,128,4,Black
ASRock B660M-ITX/ac,,LGA1700,Mini ITX,64,2,Silver / Black
Gigabyte X570 AORUS ELITE,318.99,AM4,ATX,128,4,Black / Silver
Asus TUF GAMING B450M-PRO II,134.59,AM4,Micro ATX,128,4,Black / Yellow
Asus PRIME Z690-P D4,199.99,LGA1700,ATX,128,4,Silver / Black
ASRock B760M PG SONIC WiFi,139.99,LGA1700,Micro ATX,128,4,Blue / Silver
ASRock Z690 Pro RS,149.99,LGA1700,ATX,128,4,Silver / Black
Asus TUF GAMING B450M-PLUS II,128.99,AM4,Micro ATX,128,4,Black
Gigabyte B550 VISION D-P,,AM4,ATX,128,4,White / Black
Asus ROG STRIX Z690-A GAMING WIFI,192.32,LGA1700,ATX,128,4,Black / Silver
ASRock Z690 Phantom Gaming 4,139.99,LGA1700,ATX,128,4,Black / Silver
ASRock Z590 Steel Legend,114.5,LGA1200,ATX,128,4,Silver / Black
Asus ROG STRIX Z490-E GAMING,369.77,LGA1200,ATX,128,4,Black
MSI MAG B550M MORTAR WIFI,279.25,AM4,Micro ATX,128,4,Silver / Black
ASRock Z690 Steel Legend,139.99,LGA1700,ATX,128,4,Silver / Black
ASRock A320M-HDV R4.0,,AM4,Micro ATX,32,2,Black / White
ASRock A620M-HDV/M.2+,95.99,AM5,Micro ATX,64,2,Gray / Black
Asus ROG STRIX B760-A GAMING WIFI,244.99,LGA1700,ATX,128,4,Silver / Black
Gigabyte B450 AORUS M,,AM4,Micro ATX,64,4,Black / Gray
ASRock B550 PG Velocita,129.99,AM4,ATX,128,4,Silver / Black
MSI Z370-A PRO,,LGA1151,ATX,64,4,Brown / Black
Asus ASUS B85M-E,113.11,LGA1150,Micro ATX,32,4,Black / Gold
Gigabyte H610I,119.99,LGA1700,Mini ITX,64,2,Black
Asus ROG MAXIMUS Z690 EXTREME,949.99,LGA1700,EATX,128,4,
Asus PRIME H310M-E R2.0,189.0,LGA1151,Micro ATX,32,2,Black
MSI B450 TOMAHAWK MAX II,,AM4,ATX,128,4,Black / Silver
ASRock B660M Phantom Gaming 4,133.61,LGA1700,Micro ATX,128,4,Silver / Black
MSI MPG B550 GAMING EDGE WIFI,,AM4,ATX,128,4,Black / Silver
Asus PRIME B550M-A AC,128.99,AM4,Micro ATX,128,4,Black / Silver
MSI B560M PRO-E,131.44,LGA1200,Micro ATX,64,2,Black
ASRock X570 Pro4,150.99,AM4,ATX,128,4,Black / Silver
Asus TUF GAMING H670-PRO WIFI D4,179.99,LGA1700,ATX,128,4,Gray / Black
ASRock H670M-ITX/ax,169.99,LGA1700,Mini ITX,64,2,Silver / Black
Gigabyte B450 AORUS ELITE,,AM4,ATX,64,4,Black / Silver
Asus PRIME H610M-E D4,121.9,LGA1700,Micro ATX,64,2,Silver / Black
Asus Prime X470-Pro,,AM4,ATX,64,4,Black / White
Gigabyte Z590 VISION G,219.99,LGA1200,ATX,128,4,Black / White
ASRock X570 Taichi,218.99,AM4,ATX,128,4,Black / Silver
MSI B450-A PRO MAX,,AM4,ATX,64,4,Brown / Black
ASRock H510M-ITX/ac,211.0,LGA1200,Mini ITX,64,2,Silver / Black
Gigabyte B650E AORUS MASTER,484.09,AM5,ATX,128,4,Black / Silver
Asus PRIME H510M-E,98.05,LGA1200,Micro ATX,64,2,Silver / Black
MSI PRO H610M-G WIFI DDR4,109.99,LGA1700,Micro ATX,64,2,Black / Silver
MSI MPG Z390 GAMING EDGE AC,357.88,LGA1151,ATX,128,4,Black / Silver
MSI PRO B760-P WIFI,169.99,LGA1700,ATX,192,4,Black / Silver
MSI PRO B760M-P,,LGA1700,Micro ATX,192,4,Black
MSI MAG B560M MORTAR,129.99,LGA1200,Micro ATX,128,4,Black
Gigabyte X670 GAMING X AX (rev. 1.0),343.16,AM5,ATX,128,4,Black
Gigabyte H610I DDR4,109.99,LGA1700,Mini ITX,64,2,Black / Gray
Asus PRIME B760M-A D4,144.99,LGA1700,Micro ATX,128,4,Silver / Black
Asus PRIME Z270-A,442.22,LGA1151,ATX,64,4,Black / White
MSI MAG X570 TOMAHAWK WIFI,,AM4,ATX,128,4,Black
Asus TUF GAMING X570-PLUS,228.89,AM4,ATX,128,4,Black / Gold
MSI PRO-H610M-E-DDR4,,LGA1700,Micro ATX,64,2,Black
Gigabyte B660 DS3H AX DDR4,180.21,LGA1700,ATX,128,4,Black
ASRock Z690 Phantom Gaming-ITX/TB4,245.99,LGA1700,Mini ITX,64,2,Black / Red
Asus ROG CROSSHAIR X670E GENE,646.95,AM5,Micro ATX,64,2,Black / Silver
ASRock B760M-HDV/M.2 D4,109.99,LGA1700,Micro ATX,64,2,Silver / Black
MSI PRO B660M-A DDR4,179.99,LGA1700,Micro ATX,128,4,Black / Silver
Asus TUF GAMING B760-PLUS WIFI,209.99,LGA1700,ATX,128,4,Black
NZXT N5 Z690,239.99,LGA1700,ATX,128,4,Black
ASRock H610M-HDV,92.83,LGA1700,Micro ATX,64,2,Gray / Black
Gigabyte X570 AORUS ELITE WIFI,375.99,AM4,ATX,128,4,Black
MSI MPG Z390 GAMING PLUS,,LGA1151,ATX,128,4,Black / Red
Gigabyte B365M DS3H,,LGA1151,Micro ATX,64,4,Black
ASRock B550 Extreme4,164.99,AM4,ATX,128,4,Blue / Black
Asus PRIME B760M-A WIFI D4,,LGA1700,Micro ATX,128,4,Silver / Black
ASRock Z590 Pro4,,LGA1200,ATX,128,4,Silver / Black
Asus TUF GAMING X670E-PLUS,349.07,AM5,ATX,128,4,Black / Orange
MSI X570-A PRO,259.0,AM4,ATX,128,4,Black / Silver
Gigabyte Z690 AERO G DDR4,215.95,LGA1700,ATX,128,4,Black / Silver
Asus ROG MAXIMUS XI HERO (WI-FI),455.0,LGA1151,ATX,128,4,Black
Asus PRIME B560M-A,,LGA1200,Micro ATX,128,4,Silver / Black
